{
  "$schema": "./harness.schema.json",
  "maxSteps": 12,
  "maxInstructionChars": 0,
  "docsMaxChars": 10000000,
  "docsFolder": "specs/active",
  "timeoutMs": 600000,
  "contextResetMode": "adaptive",
  "contextResetThreshold": 0.7,
  "contextFallbackFeatures": 1,
  "maxFeatures": 10,
  "stepsPerFeature": 8,
  "maxReplans": 2
}